{"apiVersion":"alpha.platform.package/v0.1","files":[{"digest":"sha256:1313131313131313131313131313131313131313131313131313131313131313","mediaType":"application/vnd.alpha.python-handler+tar+zstd","owner":"component:monitor-worker","path":".platform/artifacts/monitor-worker/1313131313131313131313131313131313131313131313131313131313131313/backend.tar.zst","role":"component-artifact","sizeBytes":24576},{"digest":"sha256:1919191919191919191919191919191919191919191919191919191919191919","mediaType":"application/vnd.alpha.native-view+json","owner":"component:records-view","path":".platform/artifacts/records-view/1919191919191919191919191919191919191919191919191919191919191919/view.json","role":"component-artifact","sizeBytes":2800},{"digest":"sha256:7170eab5f674468d17d57c65a7262bf9f603c345f26de19d900321b38ac22e7d","mediaType":"application/vnd.alpha.resolved-app+json","owner":"package:resolved","path":"app.resolved.json","role":"resolved-manifest","sizeBytes":16065},{"digest":"sha256:d7acb4fc95821ce44aa071b3313350fec4252f3400d722df66ebfb9f607f8586","mediaType":"application/yaml","owner":"package:source","path":"app.yaml","role":"source-manifest","sizeBytes":5370},{"digest":"sha256:1414141414141414141414141414141414141414141414141414141414141414","mediaType":"application/vnd.alpha.python-lock+json","owner":"component:monitor-worker","path":"components/backend.lock.json","role":"dependency-lock","sizeBytes":4096},{"digest":"sha256:1818181818181818181818181818181818181818181818181818181818181818","mediaType":"application/zstd","owner":"component:monitor-worker","path":"components/backend.tar.zst","role":"component-source","sizeBytes":20000},{"digest":"sha256:2525252525252525252525252525252525252525252525252525252525252525","mediaType":"application/schema+json","owner":"configuration:schema","path":"schemas/config.schema.json","role":"schema","sizeBytes":1900},{"digest":"sha256:3535353535353535353535353535353535353535353535353535353535353535","mediaType":"application/schema+json","owner":"resource:monitored-records","path":"schemas/record.schema.json","role":"schema","sizeBytes":2400},{"digest":"sha256:3131313131313131313131313131313131313131313131313131313131313131","mediaType":"application/schema+json","owner":"entrypoint:refresh-records","path":"schemas/refresh-input.schema.json","role":"schema","sizeBytes":900},{"digest":"sha256:3232323232323232323232323232323232323232323232323232323232323232","mediaType":"application/schema+json","owner":"entrypoint:refresh-records","path":"schemas/refresh-output.schema.json","role":"schema","sizeBytes":1100},{"digest":"sha256:3939393939393939393939393939393939393939393939393939393939393939","mediaType":"application/schema+json","owner":"trigger:weekly-refresh","path":"schemas/schedule.schema.json","role":"schema","sizeBytes":1200},{"digest":"sha256:3333333333333333333333333333333333333333333333333333333333333333","mediaType":"application/schema+json","owner":"entrypoint:search-records","path":"schemas/search-input.schema.json","role":"schema","sizeBytes":1300},{"digest":"sha256:3434343434343434343434343434343434343434343434343434343434343434","mediaType":"application/schema+json","owner":"entrypoint:search-records","path":"schemas/search-output.schema.json","role":"schema","sizeBytes":1500},{"digest":"sha256:3737373737373737373737373737373737373737373737373737373737373737","mediaType":"application/json","owner":"test:refresh-outcome","path":"tests/refresh.fixture.json","role":"test-fixture","sizeBytes":3100},{"digest":"sha256:3838383838383838383838383838383838383838383838383838383838383838","mediaType":"application/json","owner":"test:search-fixture","path":"tests/search.fixture.json","role":"test-fixture","sizeBytes":2100},{"digest":"sha256:4040404040404040404040404040404040404040404040404040404040404040","mediaType":"text/x-python","owner":"test:parser-unit","path":"tests/test_parser.py","role":"test","sizeBytes":1700},{"digest":"sha256:2424242424242424242424242424242424242424242424242424242424242424","mediaType":"application/json","owner":"configuration:defaults","path":"ui/config.defaults.json","role":"ui-definition","sizeBytes":320},{"digest":"sha256:2626262626262626262626262626262626262626262626262626262626262626","mediaType":"application/json","owner":"configuration:ui","path":"ui/config.ui.json","role":"ui-definition","sizeBytes":640},{"digest":"sha256:2323232323232323232323232323232323232323232323232323232323232323","mediaType":"application/yaml","owner":"component:records-view","path":"ui/records.yaml","role":"ui-definition","sizeBytes":2100}],"kind":"AppPackageIndex","resolvedManifest":{"digest":"sha256:7170eab5f674468d17d57c65a7262bf9f603c345f26de19d900321b38ac22e7d","path":"app.resolved.json"},"sourceManifest":{"canonicalDigest":"sha256:b080dd7fd98c59f7bd91c9983d0b68872efc140ba47abdc73a81af31e2984573","digest":"sha256:d7acb4fc95821ce44aa071b3313350fec4252f3400d722df66ebfb9f607f8586","path":"app.yaml"}}
